{
  "schemaVersion": 1,
  "asOf": "2026-08-11",
  "status": "transitive_effect_map_ready_execution_gated",
  "purpose": "Describe and independently validate every nested workflow, public-network, protected-input, write, credential, and external-action boundary reachable from A-041 and A-042 cadence packets so top-level command labels cannot hide transitive effects or duplicate collection.",
  "decisionRefs": ["D-014", "D-017"],
  "riskRefs": ["R-011", "R-013"],
  "workflowRefs": ["A-001", "A-002", "A-012", "A-014", "A-015", "A-016", "A-017", "A-023", "A-024", "A-025", "A-029", "A-030", "A-041", "A-042"],
  "authority": {
    "packetExecutionAuthorized": false,
    "schedulerActivationAuthorized": false,
    "triggerActivationAuthorized": false,
    "protectedInputBindingAuthorized": false,
    "networkActivationAuthorized": false,
    "historyPersistenceAuthorized": false,
    "repositoryWriteAuthorized": false,
    "credentialUseAuthorized": false,
    "automatedDispatchAuthorized": false,
    "spendAuthorized": false,
    "externalActionAuthorized": false,
    "conversationIsAuthorization": false
  },
  "effectBoundaries": [
    {
      "id": "TEB-001",
      "sourceIds": ["OC-001"],
      "rootWorkflowId": "A-012",
      "commandTemplate": ["scripts/company/run-company-control-plane.cjs"],
      "sourceEvidenceKind": "control_plane_default_without_online_flag",
      "nestedWorkflowMode": "registered_nonrecursive_control_list",
      "networkMode": "none",
      "networkReadWorkflowIds": [],
      "protectedInputBindingRequired": false,
      "inputSourceWorkflowId": null,
      "inputDigestRequired": false,
      "inputBindingConfigured": false,
      "fallbackInvocationIfBindingMissing": "none",
      "mayWrite": false,
      "mayUseCredentials": false,
      "mayCauseExternalAction": false
    },
    {
      "id": "TEB-002",
      "sourceIds": ["OC-002", "OT-001"],
      "rootWorkflowId": "A-012",
      "commandTemplate": ["scripts/company/run-company-control-plane.cjs", "--verify"],
      "sourceEvidenceKind": "control_plane_verify_without_online_flag",
      "nestedWorkflowMode": "registered_controls_plus_offline_evaluators",
      "networkMode": "none",
      "networkReadWorkflowIds": [],
      "protectedInputBindingRequired": false,
      "inputSourceWorkflowId": null,
      "inputDigestRequired": false,
      "inputBindingConfigured": false,
      "fallbackInvocationIfBindingMissing": "none",
      "mayWrite": false,
      "mayUseCredentials": false,
      "mayCauseExternalAction": false
    },
    {
      "id": "TEB-003",
      "sourceIds": ["OC-003"],
      "rootWorkflowId": "A-015",
      "commandTemplate": ["scripts/company/detect-company-control-plane-changes.cjs"],
      "sourceEvidenceKind": "change_detector_invokes_control_plane_online",
      "nestedWorkflowMode": "A-015_to_A-012_online_to_A-001_public_read",
      "networkMode": "public_read_via_nested_A-001_only",
      "networkReadWorkflowIds": ["A-001"],
      "protectedInputBindingRequired": false,
      "inputSourceWorkflowId": null,
      "inputDigestRequired": false,
      "inputBindingConfigured": false,
      "fallbackInvocationIfBindingMissing": "none",
      "mayWrite": false,
      "mayUseCredentials": false,
      "mayCauseExternalAction": false
    },
    {
      "id": "TEB-004",
      "sourceIds": ["OC-004"],
      "rootWorkflowId": "A-002",
      "commandTemplate": ["scripts/company/compile-weekly-review.cjs"],
      "sourceEvidenceKind": "weekly_review_reads_structured_files_only",
      "nestedWorkflowMode": "none",
      "networkMode": "none",
      "networkReadWorkflowIds": [],
      "protectedInputBindingRequired": false,
      "inputSourceWorkflowId": null,
      "inputDigestRequired": false,
      "inputBindingConfigured": false,
      "fallbackInvocationIfBindingMissing": "none",
      "mayWrite": false,
      "mayUseCredentials": false,
      "mayCauseExternalAction": false
    },
    {
      "id": "TEB-005",
      "sourceIds": ["OT-002"],
      "rootWorkflowId": "A-016",
      "commandTemplate": ["scripts/company/build-company-run-record.cjs", "--input", "{protected_trigger_payload_path}"],
      "sourceEvidenceKind": "run_record_uses_protected_A-015_input_without_output_dir",
      "nestedWorkflowMode": "none_when_input_bound",
      "networkMode": "none",
      "networkReadWorkflowIds": [],
      "protectedInputBindingRequired": true,
      "inputSourceWorkflowId": "A-015",
      "inputDigestRequired": true,
      "inputBindingConfigured": false,
      "fallbackInvocationIfBindingMissing": "prohibited_by_disabled_packet",
      "mayWrite": false,
      "mayUseCredentials": false,
      "mayCauseExternalAction": false
    },
    {
      "id": "TEB-006",
      "sourceIds": ["OT-003"],
      "rootWorkflowId": "A-017",
      "commandTemplate": ["scripts/company/propose-control-plane-baseline-update.cjs", "--input", "{protected_trigger_payload_path}"],
      "sourceEvidenceKind": "baseline_proposal_uses_protected_A-015_input",
      "nestedWorkflowMode": "none_when_input_bound",
      "networkMode": "none",
      "networkReadWorkflowIds": [],
      "protectedInputBindingRequired": true,
      "inputSourceWorkflowId": "A-015",
      "inputDigestRequired": true,
      "inputBindingConfigured": false,
      "fallbackInvocationIfBindingMissing": "prohibited_by_disabled_packet",
      "mayWrite": false,
      "mayUseCredentials": false,
      "mayCauseExternalAction": false
    },
    {
      "id": "TEB-007",
      "sourceIds": ["OT-004"],
      "rootWorkflowId": "A-030",
      "commandTemplate": ["scripts/company/run-internal-shadow-cycle.cjs"],
      "sourceEvidenceKind": "shadow_runtime_exact_no_write_step_allowlist",
      "nestedWorkflowMode": "A-014_A-023_A-024_A-025_A-029_only",
      "networkMode": "none",
      "networkReadWorkflowIds": [],
      "protectedInputBindingRequired": false,
      "inputSourceWorkflowId": null,
      "inputDigestRequired": false,
      "inputBindingConfigured": false,
      "fallbackInvocationIfBindingMissing": "none",
      "mayWrite": false,
      "mayUseCredentials": false,
      "mayCauseExternalAction": false
    }
  ],
  "sourceAssurance": {
    "packetCompilerCompared": true,
    "liveSourcePatternsCompared": true,
    "shadowRuntimeStepsCompared": true,
    "unknownTransitiveEffectsPermitted": false,
    "topLevelRegistryEffectAloneIsSufficient": false,
    "protectedInputPlaceholderCountsAsConfigured": false,
    "publicReadMayBeRepeatedByDownstreamTrigger": false
  },
  "activationGates": [
    { "id": "TE-G01", "gate": "Every admitted packet source digest matches the independently reviewed A-042 packet set", "satisfied": false },
    { "id": "TE-G02", "gate": "Static and runtime tracing confirm every nested invocation and conditional fallback path", "satisfied": false },
    { "id": "TE-G03", "gate": "The only network-capable packet is OC-003 and its egress is restricted to approved A-001 public reads", "satisfied": false },
    { "id": "TE-G04", "gate": "OT-002 and OT-003 consume one protected digest-verified A-015 result without repeating collection", "satisfied": false },
    { "id": "TE-G05", "gate": "Protected payload binding rejects missing, stale, substituted, malformed, replayed, and mismatched workflow output", "satisfied": false },
    { "id": "TE-G06", "gate": "Argument allowlists prevent output-directory writes, online flags, unregistered paths, and placeholder injection", "satisfied": false },
    { "id": "TE-G07", "gate": "Ephemeral runtime tracing observes zero unexpected file, network, credential, subprocess, and external effects", "satisfied": false },
    { "id": "TE-G08", "gate": "A material source or call-graph change invalidates prior packets and requires independent reevaluation", "satisfied": false },
    { "id": "TE-G09", "gate": "Protected history binds parent and child run IDs, packet digest, payload digest, identity, and outcome", "satisfied": false },
    { "id": "TE-G10", "gate": "Timeout, cancellation, kill, and partial-failure tests terminate the complete nested process tree", "satisfied": false },
    { "id": "TE-G11", "gate": "Four accurate independently reviewed shadow cycles show no hidden or duplicated effect", "satisfied": false },
    { "id": "TE-G12", "gate": "Separate expiring approval admits exact packet and effect digests without granting downstream authority", "satisfied": false }
  ],
  "effectBoundaryCount": 7,
  "coveredPacketCount": 8,
  "publicNetworkPacketCount": 1,
  "protectedInputBindingPacketCount": 2,
  "configuredInputBindingPacketCount": 0,
  "unknownTransitiveEffectCount": 0,
  "satisfiedActivationGateCount": 0,
  "effectMapReadyForReview": true,
  "runtimeTracingReady": false,
  "packetExecutionReady": false,
  "externalActionAuthorized": false,
  "nextDecision": "Review this effect map with D-017 and the A-041/A-042 packet set. Do not activate a binding or packet until live tracing, protected payload verification, process-tree kill, history, alert, shadow-cycle, and separate expiring admission gates pass."
}
